<?xml version="1.0" encoding="UTF-8"?>
<!DOCTYPE donnees SYSTEM "generateur.dtd">
<donnees>
  <lot name="manuelles">
    <donnee>
      <position x="1" y="1">
        <valeur>5.0</valeur>
      </position>
    </donnee>
    <donnee>
      <position x="1" y="2">
        <valeur>2.0</valeur>
      </position>
    </donnee>
    <donnee>
      <position x="1" y="1">
        <valeur>-1.0</valeur>
      </position>
    </donnee>
  </lot>
</donnees>
